{
  "id": "2023_Mai_Stadtverordnetenversammlung_Niederschrift_STV",
  "document_type": "Niederschrift",
  "session_type": "Stadtverordnetenversammlung",
  "date": "2023-05-04T00:00:00Z",
  "duration": "19:03  Uhr bis 20:44  Uhr",
  "location": "Volkshalle Watzenborn -Steinberg, Ludwigstraße 33 -35, 35415 Pohlheim",
  "attendance_present": [
    {
      "name": "STV Peter Alexander",
      "function": "Von der Stadtverordnetenversammlung",
      "status": "present"
    },
    {
      "name": "STV Malke Aydin",
      "function": "Von der Stadtverordnetenversammlung",
      "status": "present"
    },
    {
      "name": "STV Angelika Bartosch",
      "function": "Von der Stadtverordnetenversammlung",
      "status": "present"
    },
    {
      "name": "STV Karsten Becker",
      "function": "Von der Stadtverordnetenversammlung",
      "status": "present"
    },
    {
      "name": "STV Horst Jürgen Briegel",
      "function": "Von der Stadtverordnetenversammlung",
      "status": "present"
    },
    {
      "name": "STV Risko Bulut",
      "function": "Von der Stadtverordnetenversammlung",
      "status": "present"
    },
    {
      "name": "STV Sonya Can",
      "function": "Von der Stadtverordnetenversammlung",
      "status": "present"
    },
    {
      "name": "STV Georg Celik",
      "function": "Von der Stadtverordnetenversammlung",
      "status": "present"
    },
    {
      "name": "STV Iliyo Danho",
      "function": "Von der Stadtverordnetenversammlung",
      "status": "present"
    },
    {
      "name": "STV Lorenz Diehl",
      "function": "Von der Stadtverordnetenversammlung",
      "status": "present"
    },
    {
      "name": "STV Kevin Engel",
      "function": "Von der Stadtverordnetenversammlung",
      "status": "present"
    },
    {
      "name": "STV Björn Feuerbach",
      "function": "Von der Stadtverordnetenversammlung",
      "status": "present"
    },
    {
      "name": "STV Samuel Gergin",
      "function": "Von der Stadtverordnetenversammlung",
      "status": "present"
    },
    {
      "name": "STV Eckart Hafemann",
      "function": "Von der Stadtverordnetenversammlung",
      "status": "present"
    },
    {
      "name": "STV Simon Hafemann",
      "function": "Von der Stadtverordnetenversammlung",
      "status": "present"
    },
    {
      "name": "STV Uwe Happel",
      "function": "Von der Stadtverordnetenversammlung",
      "status": "present"
    },
    {
      "name": "STV Antje Häuser",
      "function": "Von der Stadtverordnetenversammlung",
      "status": "present"
    },
    {
      "name": "STV Prof. Dr. Ernst -Ulrich Huster",
      "function": "Von der Stadtverordnetenversammlung",
      "status": "present"
    },
    {
      "name": "STV Bettina Jost",
      "function": "Von der Stadtverordnetenversammlung",
      "status": "present"
    },
    {
      "name": "STV Norman Klotz",
      "function": "Von der Stadtverordnetenversammlung",
      "status": "present"
    },
    {
      "name": "STV Michel Kögler",
      "function": "Von der Stadtverordnetenversammlung",
      "status": "present"
    },
    {
      "name": "STV Matthias Kücükkaplan",
      "function": "Von der Stadtverordnetenversammlung",
      "status": "present"
    },
    {
      "name": "STV Reiner Leidich",
      "function": "Von der Stadtverordnetenversammlung",
      "status": "present"
    },
    {
      "name": "STV Dr. Melanie Neeb",
      "function": "Von der Stadtverordnetenversammlung",
      "status": "present"
    },
    {
      "name": "STV Marc Werner Punzert",
      "function": "Von der Stadtverordnetenversammlung",
      "status": "present"
    },
    {
      "name": "STV Fabian Schäfer",
      "function": "Von der Stadtverordnetenversammlung",
      "status": "present"
    },
    {
      "name": "STV Michaela Schöffmann",
      "function": "Von der Stadtverordnetenversammlung",
      "status": "present"
    },
    {
      "name": "STV Andreas Schuch",
      "function": "Von der Stadtverordnetenversammlung",
      "status": "present"
    },
    {
      "name": "STV Melanie Schunk -Wießner",
      "function": "Von der Stadtverordnetenversammlung",
      "status": "present"
    },
    {
      "name": "STV Prof. Dr. Helge Stadelmann",
      "function": "Von der Stadtverordnetenversammlung",
      "status": "present"
    },
    {
      "name": "STV Fadi Touma",
      "function": "Von der Stadtverordnetenversammlung",
      "status": "present"
    },
    {
      "name": "STV Simone van Slobbe -Schneider",
      "function": "Von der Stadtverordnetenversammlung",
      "status": "present"
    },
    {
      "name": "STV/021/2021 -2026  STV Malek Yacoub",
      "function": "Von der Stadtverordnetenversammlung",
      "status": "present"
    },
    {
      "name": "Bürgermeister Andreas Ruck",
      "function": "Vom Magistrat",
      "status": "present"
    },
    {
      "name": "Stadtrat Jörg Buß",
      "function": "Vom Magistrat",
      "status": "present"
    },
    {
      "name": "Stadtrat Philipp Niklas Mackowiak",
      "function": "Vom Magistrat",
      "status": "present"
    },
    {
      "name": "Stadtrat Ewald Seidler",
      "function": "Vom Magistrat",
      "status": "present"
    },
    {
      "name": "Stefan Huster",
      "function": "Von der Verwaltung",
      "status": "present"
    },
    {
      "name": "Thomas Telling",
      "function": "Schriftführer(in)",
      "status": "present"
    },
    {
      "name": "Entschuldigt :",
      "function": "Schriftführer(in)",
      "status": "present"
    },
    {
      "name": "STV Lukas Budak",
      "function": "Von der Stadtverordnetenversammlung",
      "status": "present"
    },
    {
      "name": "STV Matthias Jung",
      "function": "Von der Stadtverordnetenversammlung",
      "status": "present"
    },
    {
      "name": "STV Erich Klotz",
      "function": "Von der Stadtverordnetenversammlung",
      "status": "present"
    },
    {
      "name": "Stadtrat Israel Be Josef",
      "function": "Vom Magistrat",
      "status": "present"
    },
    {
      "name": "Erster Stadtrat Klaus Dieter Gimbel",
      "function": "Vom Magistrat",
      "status": "present"
    },
    {
      "name": "Stadtrat Reinhard Peter",
      "function": "Vom Magistrat",
      "status": "present"
    },
    {
      "name": "Stadtrat Dr. Karl Ernst Rainer Pfaff",
      "function": "Vom Magistrat",
      "status": "present"
    },
    {
      "name": "Stadtrat Wolfgang Sames",
      "function": "Vom Magistrat",
      "status": "present"
    }
  ],
  "attendance_excused": [],
  "total_present": 48,
  "total_excused": 0,
  "total_participants": 48,
  "analysis_method": "Azure + Local",
  "total_pages": 2,
  "extraction_timestamp": "2025-09-13T22:31:39.324318",
  "document_path": "input\\2023_Mai_Stadtverordnetenversammlung_Niederschrift_STV.pdf",
  "full_text": "Stadt Pohlheim\nPohlheim, 10.05.2023\nAz .: STV/021/2021-2026\nNIEDERSCHRIFT\nüber die Sitzung der Stadtverordnetenversammlung der Stadt Pohlheim\nTag:\n04.05.2023\nDauer:\n19:03 Uhr bis 20:44 Uhr\nOrt:\nVolkshalle Watzenborn-Steinberg, Ludwigstraße 33-35, 35415 Pohlheim\nAnwesend:\nVon der Stadtverordnetenversammlung\nStadtverordnetenvorsteherin Hiltrud Hofmann\nSTV Peter Alexander\nSTV Malke Aydin\nSTV Angelika Bartosch\nSTV Karsten Becker\nSTV Horst Jürgen Briegel\nSTV Risko Bulut\nSTV Sonya Can\nSTV Georg Celik\nSTV Iliyo Danho\nSTV Lorenz Diehl\nSTV Kevin Engel\nSTV Björn Feuerbach\nSTV Samuel Gergin\nSTV Eckart Hafemann\nSTV Simon Hafemann\nSTV Uwe Happel\nSTV Antje Häuser\nSTV Prof. Dr. Ernst-Ulrich Huster\nSTV Bettina Jost\nSTV Norman Klotz\nSTV Michel Kögler\nSTV Matthias Kücükkaplan\nSTV Reiner Leidich\nSTV Dr. Melanie Neeb\nSTV Marc Werner Punzert\nSTV Fabian Schäfer\nSTV Michaela Schöffmann\nSTV Andreas Schuch\nSTV Melanie Schunk-Wießner\nSTV Prof. Dr. Helge Stadelmann\nSTV Fadi Touma\nSTV Simone van Slobbe-Schneider\nSeite 1 von 10\nSTV/021/2021-2026\nSTV Malek Yacoub\nVom Magistrat\nBürgermeister Andreas Ruck\nStadtrat Jörg Buß\nStadtrat Philipp Niklas Mackowiak\nStadtrat Ewald Seidler\nVon der Verwaltung\nStefan Huster\nSchriftführer(in)\nThomas Telling\nEntschuldigt:\nVon der Stadtverordnetenversammlung\nSTV Lukas Budak\nSTV Matthias Jung\nSTV Erich Klotz\nVom Magistrat\nStadtrat Israel Be Josef\nErster Stadtrat Klaus Dieter Gimbel\nStadtrat Reinhard Peter\nStadtrat Dr. Karl Ernst Rainer Pfaff\nStadtrat Wolfgang Sames\nTAGESORDNUNG:\nTOP 1\nEröffnung sowie Feststellung der ordnungsgemäßen\nLadung und der Beschlussfähigkeit\nTOP 2\nFeststellung der Niederschrift(en) vom 23. und 24. März\n2023\nTOP 3\nPräsentation der Entwurfsplanung Kita Magdeburger\nStraße durch den Architekten\nSTV-206/2021-\n2026\nTOP 4\nAntrag \"Jugend entscheidet\" vom 9. März 2023 betr.\nÖPNV - Busverkehr\nA-194/2021-2026\nTOP 5\nAntrag \"Jugend entscheidet\" vom 9. März 2023 betr.\nErtüchtigung vorhandener Sportstätten\nA-195/2021-2026\nTOP 6\nAntrag der Fraktion Bündnis 90/Die Grünen vom 22.\nMärz 2023 betr. Bürgerbeteiligung Windpark Höhlerberg\nA-197/2021-2026\nSeite 2 von 10\nSTV/021/2021-2026\n"
}