{
  "id": "2023_November_Stadtverordnetenversammlung_Niederschrift_STV",
  "document_type": "Niederschrift",
  "session_type": "Stadtverordnetenversammlung",
  "date": "2023-11-09T00:00:00Z",
  "duration": "19:10  Uhr bis 22:02  Uhr",
  "location": "Volkshalle Watzenborn -Steinberg, Ludwigstraße 33 -35, 35415 Pohlheim",
  "attendance_present": [
    {
      "name": "STV Malke Aydin",
      "function": "Von der Stadtverordnetenversammlung",
      "status": "present"
    },
    {
      "name": "STV Angelika Bartosch",
      "function": "Von der Stadtverordnetenversammlung",
      "status": "present"
    },
    {
      "name": "STV Karsten Becker",
      "function": "Von der Stadtverordnetenversammlung",
      "status": "present"
    },
    {
      "name": "STV Horst Jürgen Briegel",
      "function": "Von der Stadtverordnetenversammlung",
      "status": "present"
    },
    {
      "name": "STV Lukas Budak",
      "function": "Von der Stadtverordnetenversammlung",
      "status": "present"
    },
    {
      "name": "STV Sonya Can",
      "function": "Von der Stadtverordnetenversammlung",
      "status": "present"
    },
    {
      "name": "STV Iliyo Danho",
      "function": "Von der Stadtverordnetenversammlung",
      "status": "present"
    },
    {
      "name": "STV Lorenz Diehl",
      "function": "Von der Stadtverordnetenversammlung",
      "status": "present"
    },
    {
      "name": "STV Kevin Engel",
      "function": "Von der Stadtverordnetenversammlung",
      "status": "present"
    },
    {
      "name": "STV Björn Feuerbach",
      "function": "Von der Stadtverordnetenversammlung",
      "status": "present"
    },
    {
      "name": "STV Samuel Gergin",
      "function": "Von der Stadtverordnetenversammlung",
      "status": "present"
    },
    {
      "name": "STV Eckart Hafemann",
      "function": "Von der Stadtverordnetenversammlung",
      "status": "present"
    },
    {
      "name": "STV Simon Hafemann",
      "function": "Von der Stadtverordnetenversammlung",
      "status": "present"
    },
    {
      "name": "STV Uwe Happel",
      "function": "Von der Stadtverordnetenversammlung",
      "status": "present"
    },
    {
      "name": "STV Antje Häuser",
      "function": "Von der Stadtverordnetenversammlung",
      "status": "present"
    },
    {
      "name": "STV Prof. Dr. Ernst -Ulrich Huster",
      "function": "Von der Stadtverordnetenversammlung",
      "status": "present"
    },
    {
      "name": "STV Bett ina Jost",
      "function": "Von der Stadtverordnetenversammlung",
      "status": "present"
    },
    {
      "name": "STV Erich Klotz",
      "function": "Von der Stadtverordnetenversammlung",
      "status": "present"
    },
    {
      "name": "STV Norman Klotz",
      "function": "Von der Stadtverordnetenversammlung",
      "status": "present"
    },
    {
      "name": "STV Michel Kögler",
      "function": "Von der Stadtverordnetenversammlung",
      "status": "present"
    },
    {
      "name": "STV Matthias Kücükkaplan",
      "function": "Von der Stadtverordnetenversammlung",
      "status": "present"
    },
    {
      "name": "STV Reiner Leidich",
      "function": "Von der Stadtverordnetenversammlung",
      "status": "present"
    },
    {
      "name": "STV Dr. Melanie Neeb",
      "function": "Von der Stadtverordnetenversammlung",
      "status": "present"
    },
    {
      "name": "STV Risko Noah",
      "function": "Von der Stadtverordnetenversammlung",
      "status": "present"
    },
    {
      "name": "STV Marc Werner Punzert",
      "function": "Von der Stadtverordnetenversammlung",
      "status": "present"
    },
    {
      "name": "STV Fabian Schäfer",
      "function": "Von der Stadtverordnetenversammlung",
      "status": "present"
    },
    {
      "name": "STV Michaela Schöffmann",
      "function": "Von der Stadtverordnetenversammlung",
      "status": "present"
    },
    {
      "name": "STV Andreas Schuch",
      "function": "Von der Stadtverordnetenversammlung",
      "status": "present"
    },
    {
      "name": "STV Me lanie Schunk -Wießner",
      "function": "Von der Stadtverordnetenversammlung",
      "status": "present"
    },
    {
      "name": "STV Prof. Dr. Helge Stadelmann",
      "function": "Von der Stadtverordnetenversammlung",
      "status": "present"
    },
    {
      "name": "STV Dominic Tamme",
      "function": "Von der Stadtverordnetenversammlung",
      "status": "present"
    },
    {
      "name": "STV Fadi Touma",
      "function": "Von der Stadtverordnetenversammlung",
      "status": "present"
    },
    {
      "name": "STV/025/2021 -2026  STV Simone van Slobbe -Schneider",
      "function": "Von der Stadtverordnetenversammlung",
      "status": "present"
    },
    {
      "name": "STV Malek Yacoub",
      "function": "Von der Stadtverordnetenversammlung",
      "status": "present"
    },
    {
      "name": "Bürgermeister Andreas Ruck",
      "function": "Vom Magistrat",
      "status": "present"
    },
    {
      "name": "Stadtrat Peter Alexander",
      "function": "Vom Magistrat",
      "status": "present"
    },
    {
      "name": "Stadtrat Israel Be Josef",
      "function": "Vom Magistrat",
      "status": "present"
    },
    {
      "name": "Stadtrat Jö rg Buß",
      "function": "Vom Magistrat",
      "status": "present"
    },
    {
      "name": "Stadtrat Reinhard Peter",
      "function": "Vom Magistrat",
      "status": "present"
    },
    {
      "name": "Stadtrat Wolfgang Sames",
      "function": "Vom Magistrat",
      "status": "present"
    },
    {
      "name": "Stadtrat Ewald Seidler",
      "function": "Vom Magistrat",
      "status": "present"
    },
    {
      "name": "Stefan Huster",
      "function": "Von der Verwaltung",
      "status": "present"
    },
    {
      "name": "Thomas Telling",
      "function": "Schriftführer(in)",
      "status": "present"
    },
    {
      "name": "Entschuldigt :",
      "function": "Schriftführer(in)",
      "status": "present"
    },
    {
      "name": "STV Georg Celik",
      "function": "Von der Stadtverordnetenversammlung",
      "status": "present"
    },
    {
      "name": "STV Matthias Jung",
      "function": "Von der Stadtverordnetenversammlung",
      "status": "present"
    },
    {
      "name": "Stadtrat Philipp Niklas Mackowiak",
      "function": "Vom Magistrat",
      "status": "present"
    },
    {
      "name": "Stadtrat Dr. Karl Ernst Rainer Pfaff",
      "function": "Vom Magistrat",
      "status": "present"
    }
  ],
  "attendance_excused": [],
  "total_present": 48,
  "total_excused": 0,
  "total_participants": 48,
  "analysis_method": "Azure + Local",
  "total_pages": 2,
  "extraction_timestamp": "2025-09-14T11:19:40.627900",
  "document_path": "input\\2023_November_Stadtverordnetenversammlung_Niederschrift_STV.pdf",
  "full_text": "Stadt Pohlheim\nPohlheim, 15.11.2023\nAz .: STV/025/2021-2026\nNIEDERSCHRIFT\nüber die Sitzung der Stadtverordnetenversammlung der Stadt Pohlheim\nTag:\n09.11.2023\nDauer:\n19:10 Uhr bis 22:02 Uhr\nOrt:\nVolkshalle Watzenborn-Steinberg, Ludwigstraße 33-35, 35415 Pohlheim\nAnwesend:\nVon der Stadtverordnetenversammlung\nStadtverordnetenvorsteherin Hiltrud Hofmann\nSTV Malke Aydin\nSTV Angelika Bartosch\nSTV Karsten Becker\nSTV Horst Jürgen Briegel\nSTV Lukas Budak\nSTV Sonya Can\nSTV Iliyo Danho\nSTV Lorenz Diehl\nSTV Kevin Engel\nSTV Björn Feuerbach\nSTV Samuel Gergin\nSTV Eckart Hafemann\nSTV Simon Hafemann\nSTV Uwe Happel\nSTV Antje Häuser\nSTV Prof. Dr. Ernst-Ulrich Huster\nSTV Bettina Jost\nSTV Erich Klotz\nSTV Norman Klotz\nSTV Michel Kögler\nSTV Matthias Kücükkaplan\nSTV Reiner Leidich\nSTV Dr. Melanie Neeb\nSTV Risko Noah\nSTV Marc Werner Punzert\nSTV Fabian Schäfer\nSTV Michaela Schöffmann\nSTV Andreas Schuch\nSTV Melanie Schunk-Wießner\nSTV Prof. Dr. Helge Stadelmann\nSTV Dominic Tamme\nSTV Fadi Touma\nSeite 1 von 16\nSTV/025/2021-2026\nSTV Simone van Slobbe-Schneider\nSTV Malek Yacoub\nVom Magistrat\nBürgermeister Andreas Ruck\nStadtrat Peter Alexander\nStadtrat Israel Be Josef\nStadtrat Jörg Buß\nStadtrat Reinhard Peter\nStadtrat Wolfgang Sames\nStadtrat Ewald Seidler\nVon der Verwaltung\nStefan Huster\nSchriftführer(in)\nThomas Telling\nEntschuldigt:\nVon der Stadtverordnetenversammlung\nSTV Georg Celik\nSTV Matthias Jung\nVom Magistrat\nStadtrat Philipp Niklas Mackowiak\nStadtrat Dr. Karl Ernst Rainer Pfaff\nTAGESORDNUNG:\nTOP 1\nEröffnung sowie Feststellung der ordnungsgemäßen\nLadung und der Beschlussfähigkeit\nTOP 2\nFeststellung der Niederschrift vom 14. September 2023\nTOP 3\nEinführung, Verpflichtung, Ernennung und Vereidigung\ndes ehrenamtlichen Ersten Stadtrates\nSTV-262/2021-\n2026\nTOP 4\nEinführung, Verpflichtung, Ernennung und Vereidigung\neines ehrenamtlichen Stadtrates\nSTV-261/2021-\n2026\nTOP 5\nBürgersolaranlagen\nSTV-249/2021-\n2026\nTOP 6\nVorlage des Entwurfs der Haushaltssatzung 2024 ge-\nmäß § 97 Hessische Gemeindeordnung\nSTV-263/2021-\n2026\nTOP 7\nBericht über den Haushaltsvollzug zum 30.09.2023\nSTV-248/2021-\n2026\nSeite 2 von 16\nSTV/025/2021-2026\n"
}