{
  "id": "2023_September_Stadtverordnetenversammlung_Niederschrift_STV",
  "document_type": "Niederschrift",
  "session_type": "Stadtverordnetenversammlung",
  "date": "2023-09-14T00:00:00Z",
  "duration": "19:05  Uhr bis 20:01  Uhr",
  "location": "Volkshalle Watzenborn -Steinberg, Ludwigstraße 33 -35, 35415 Pohlheim",
  "attendance_present": [
    {
      "name": "STV Peter Alexander",
      "function": "Von der Stadtverordnetenversammlung",
      "status": "present"
    },
    {
      "name": "STV Malke Aydin  ab TOP 3",
      "function": "Von der Stadtverordnetenversammlung",
      "status": "present"
    },
    {
      "name": "STV Angelika Bartosch",
      "function": "Von der Stadtverordnetenversammlung",
      "status": "present"
    },
    {
      "name": "STV Karsten Beck er",
      "function": "Von der Stadtverordnetenversammlung",
      "status": "present"
    },
    {
      "name": "STV Horst Jürgen Briegel",
      "function": "Von der Stadtverordnetenversammlung",
      "status": "present"
    },
    {
      "name": "STV Lukas Budak",
      "function": "Von der Stadtverordnetenversammlung",
      "status": "present"
    },
    {
      "name": "STV Sonya Can",
      "function": "Von der Stadtverordnetenversammlung",
      "status": "present"
    },
    {
      "name": "STV Georg Celik",
      "function": "Von der Stadtverordnetenversammlung",
      "status": "present"
    },
    {
      "name": "STV Iliyo Danho",
      "function": "Von der Stadtverordnetenversammlung",
      "status": "present"
    },
    {
      "name": "STV Lorenz Diehl  ab TOP 4",
      "function": "Von der Stadtverordnetenversammlung",
      "status": "present"
    },
    {
      "name": "STV Kevin Engel",
      "function": "Von der Stadtverordnetenversammlung",
      "status": "present"
    },
    {
      "name": "STV Björn Feuerbach",
      "function": "Von der Stadtverordnetenversammlung",
      "status": "present"
    },
    {
      "name": "STV Samuel Gergin",
      "function": "Von der Stadtverordnetenversammlung",
      "status": "present"
    },
    {
      "name": "STV Eckart Hafemann",
      "function": "Von der Stadtverordnetenversammlung",
      "status": "present"
    },
    {
      "name": "STV Uwe Happel",
      "function": "Von der Stadtverordnetenversammlung",
      "status": "present"
    },
    {
      "name": "STV Antje Häuser",
      "function": "Von der Stadtverordnetenversammlung",
      "status": "present"
    },
    {
      "name": "STV Prof.  Dr. Ernst -Ulrich Huster",
      "function": "Von der Stadtverordnetenversammlung",
      "status": "present"
    },
    {
      "name": "STV Erich Klotz",
      "function": "Von der Stadtverordnetenversammlung",
      "status": "present"
    },
    {
      "name": "STV Michel Kögler",
      "function": "Von der Stadtverordnetenversammlung",
      "status": "present"
    },
    {
      "name": "STV Matthias Kücükkaplan",
      "function": "Von der Stadtverordnetenversammlung",
      "status": "present"
    },
    {
      "name": "STV Reiner Leidich",
      "function": "Von der Stadtverordnetenversammlung",
      "status": "present"
    },
    {
      "name": "STV Marc Werner Punzert",
      "function": "Von der Stadtverordnetenversammlung",
      "status": "present"
    },
    {
      "name": "STV Fabian Schäfer",
      "function": "Von der Stadtverordnetenversammlung",
      "status": "present"
    },
    {
      "name": "STV Michaela Schöffmann",
      "function": "Von der Stadtverordnetenversammlung",
      "status": "present"
    },
    {
      "name": "STV Andreas Schuch",
      "function": "Von der Stadtverordnetenversammlung",
      "status": "present"
    },
    {
      "name": "STV Melanie Schunk -Wießner",
      "function": "Von der Stadtverordnetenversammlung",
      "status": "present"
    },
    {
      "name": "STV Prof. Dr. Helge Stadelmann",
      "function": "Von der Stadtverordnetenversammlung",
      "status": "present"
    },
    {
      "name": "STV Fadi Touma",
      "function": "Von der Stadtverordnetenversammlung",
      "status": "present"
    },
    {
      "name": "STV Simone van Slobbe -Schneider",
      "function": "Von der Stadtverordnetenversammlung",
      "status": "present"
    },
    {
      "name": "STV Malek Yacoub",
      "function": "Von der Stadtverordnetenversammlung",
      "status": "present"
    },
    {
      "name": "STV/024/2021 -2026",
      "function": "Vom Magistrat",
      "status": "present"
    },
    {
      "name": "Stadtrat Israel Be Josef",
      "function": "Vom Magistrat",
      "status": "present"
    },
    {
      "name": "Stadtrat Jörg Buß",
      "function": "Vom Magistrat",
      "status": "present"
    },
    {
      "name": "Stadtrat Ewald Seidler",
      "function": "Vom Magistrat",
      "status": "present"
    },
    {
      "name": "Stefan Huster",
      "function": "Von der Verwaltung",
      "status": "present"
    },
    {
      "name": "Thomas Telling",
      "function": "Schriftführer(in)",
      "status": "present"
    },
    {
      "name": "Entschuldi gt:",
      "function": "Schriftführer(in)",
      "status": "present"
    },
    {
      "name": "STV Risko Bulut",
      "function": "Von der Stadtverordnetenversammlung",
      "status": "present"
    },
    {
      "name": "STV Simon Hafemann",
      "function": "Von der Stadtverordnetenversammlung",
      "status": "present"
    },
    {
      "name": "STV Bettina Jost",
      "function": "Von der Stadtverordnetenversammlung",
      "status": "present"
    },
    {
      "name": "STV Matthias Jung",
      "function": "Von der Stadtverordnetenversammlung",
      "status": "present"
    },
    {
      "name": "STV Norman Klotz",
      "function": "Von der Stadtverordnetenversammlung",
      "status": "present"
    },
    {
      "name": "STV Dr. Melanie Neeb",
      "function": "Von der Stadtverordnetenversammlung",
      "status": "present"
    },
    {
      "name": "Bürgermeister Andreas Ruck",
      "function": "Vom Magistrat",
      "status": "present"
    },
    {
      "name": "Erster Stadtrat Klaus Dieter Gimbel",
      "function": "Vom Magistrat",
      "status": "present"
    },
    {
      "name": "Stadtrat Ph ilipp Niklas Mackowiak",
      "function": "Vom Magistrat",
      "status": "present"
    },
    {
      "name": "Stadtrat Reinhard Peter",
      "function": "Vom Magistrat",
      "status": "present"
    },
    {
      "name": "Stadtrat Dr. Karl Ernst Rainer Pfaff",
      "function": "Vom Magistrat",
      "status": "present"
    },
    {
      "name": "Stadtrat Wolfgang Sames",
      "function": "Vom Magistrat",
      "status": "present"
    }
  ],
  "attendance_excused": [],
  "total_present": 49,
  "total_excused": 0,
  "total_participants": 49,
  "analysis_method": "Azure + Local",
  "total_pages": 2,
  "extraction_timestamp": "2025-09-13T22:32:28.227179",
  "document_path": "input\\2023_September_Stadtverordnetenversammlung_Niederschrift_STV.pdf",
  "full_text": "Stadt Pohlheim\nPohlheim, 19.09.2023\nAz .: STV/024/2021-2026\nNIEDERSCHRIFT\nüber die Sitzung der Stadtverordnetenversammlung der Stadt Pohlheim\nTag:\n14.09.2023\nDauer:\n19:05 Uhr bis 20:01 Uhr\nOrt:\nVolkshalle Watzenborn-Steinberg, Ludwigstraße 33-35, 35415 Pohlheim\nAnwesend:\nVon der Stadtverordnetenversammlung\nStadtverordnetenvorsteherin Hiltrud Hofmann\nSTV Peter Alexander\nSTV Malke Aydin\nab TOP 3\nSTV Angelika Bartosch\nSTV Karsten Becker\nSTV Horst Jürgen Briegel\nSTV Lukas Budak\nSTV Sonya Can\nSTV Georg Celik\nSTV Iliyo Danho\nSTV Lorenz Diehl\nSTV Kevin Engel\nSTV Björn Feuerbach\nSTV Samuel Gergin\nSTV Eckart Hafemann\nSTV Uwe Happel\nab TOP 4\nSTV Antje Häuser\nSTV Prof. Dr. Ernst-Ulrich Huster\nSTV Erich Klotz\nSTV Michel Kögler\nSTV Matthias Kücükkaplan\nSTV Reiner Leidich\nSTV Marc Werner Punzert\nSTV Fabian Schäfer\nSTV Michaela Schöffmann\nSTV Andreas Schuch\nSTV Melanie Schunk-Wießner\nSTV Prof. Dr. Helge Stadelmann\nSTV Fadi Touma\nSTV Simone van Slobbe-Schneider\nSTV Malek Yacoub\nVom Magistrat\nSeite 1 von 7\nSTV/024/2021-2026\nStadtrat Israel Be Josef\nStadtrat Jörg Buß\nStadtrat Ewald Seidler\nVon der Verwaltung\nStefan Huster\nSchriftführer(in)\nThomas Telling\nEntschuldigt:\nVon der Stadtverordnetenversammlung\nSTV Risko Bulut\nSTV Simon Hafemann\nSTV Bettina Jost\nSTV Matthias Jung\nSTV Norman Klotz\nSTV Dr. Melanie Neeb\nVom Magistrat\nBürgermeister Andreas Ruck\nErster Stadtrat Klaus Dieter Gimbel\nStadtrat Philipp Niklas Mackowiak\nStadtrat Reinhard Peter\nStadtrat Dr. Karl Ernst Rainer Pfaff\nStadtrat Wolfgang Sames\nTAGESORDNUNG:\nTOP 1\nEröffnung sowie Feststellung der ordnungsgemäßen\nLadung und der Beschlussfähigkeit\nTOP 2\nFeststellung der Niederschrift vom 20. Juli 2023\nTOP 3\nVergabe der Leitungs- und Wegerechte in der Sparte\nStrom nach § 46 Gesetz über die Elektrizitäts- und Gas-\nversorgung (EnWG); Konzessionsvertrag \"Strom\"\nSTV-241/2021-\n2026\nTOP 4\nEigenwirtschaftlicher Glasfaserausbau mit der deut-\nschen GigaNetz\nSTV-245/2021-\n2026\nTOP 5\nBaugebiet \"Hinter der Friedensstraße\" im Stadtteil Gar-\nbenteich;\nAuftrag zur Entwicklung eines städtebaulichen Konzep-\ntes mit integrierter Bauleitplanung\nSTV-228/2021-\n2026\nTOP 6\nAntrag der Fraktion FREIE WÄHLER vom 27. Juni 2023\nbetr. Jährlicher Bericht der Vertreterinnen und Vertreter\nA-232/2021-2026\nSeite 2 von 7\nSTV/024/2021-2026\n"
}