{
  "id": "2023_Juli_Stadtverordnetenversammlung_Niederschrift_STV",
  "document_type": "Niederschrift",
  "session_type": "Stadtverordnetenversammlung",
  "date": "2023-07-20T00:00:00Z",
  "duration": "19:12  Uhr bis 21:25  Uhr",
  "location": "Volkshalle Watzenborn -Steinberg, Ludwigstraße 33 -35, 35415 Pohlheim",
  "attendance_present": [
    {
      "name": "STV Peter Alexander",
      "function": "Von der Stadtverordnetenversammlung",
      "status": "present"
    },
    {
      "name": "STV Malke Aydin  ab TOP 3",
      "function": "Von der Stadtverordnetenversammlung",
      "status": "present"
    },
    {
      "name": "STV Angelika Bartosch",
      "function": "Von der Stadtverordnetenversammlung",
      "status": "present"
    },
    {
      "name": "STV Karsten Beck er ab TOP 3",
      "function": "Von der Stadtverordnetenversammlung",
      "status": "present"
    },
    {
      "name": "STV Horst Jürgen Briegel  ab TOP 3",
      "function": "Von der Stadtverordnetenversammlung",
      "status": "present"
    },
    {
      "name": "STV Lukas Budak",
      "function": "Von der Stadtverordnetenversammlung",
      "status": "present"
    },
    {
      "name": "STV Risko Bulut",
      "function": "Von der Stadtverordnetenversammlung",
      "status": "present"
    },
    {
      "name": "STV Sonya Can",
      "function": "Von der Stadtverordnetenversammlung",
      "status": "present"
    },
    {
      "name": "STV Georg Celik",
      "function": "Von der Stadtverordnetenversammlung",
      "status": "present"
    },
    {
      "name": "STV Iliyo Danho",
      "function": "Von der Stadtverordnetenversammlung",
      "status": "present"
    },
    {
      "name": "STV Lorenz Diehl",
      "function": "Von der Stadtverordnetenversammlung",
      "status": "present"
    },
    {
      "name": "STV Kevin Engel",
      "function": "Von der Stadtverordnetenversammlung",
      "status": "present"
    },
    {
      "name": "STV Björn Feuerbach",
      "function": "Von der Stadtverordnetenversammlung",
      "status": "present"
    },
    {
      "name": "STV Samuel Gergin",
      "function": "Von der Stadtverordnetenversammlung",
      "status": "present"
    },
    {
      "name": "STV Eckart Hafemann",
      "function": "Von der Stadtverordnetenversammlung",
      "status": "present"
    },
    {
      "name": "STV Uwe Happel",
      "function": "Von der Stadtverordnetenversammlung",
      "status": "present"
    },
    {
      "name": "STV Antje Häuser",
      "function": "Von der Stadtverordnetenversammlung",
      "status": "present"
    },
    {
      "name": "STV Prof. Dr. Ernst -Ulrich Huster",
      "function": "Von der Stadtverordnetenversammlung",
      "status": "present"
    },
    {
      "name": "STV Bettina Jost",
      "function": "Von der Stadtverordnetenversammlung",
      "status": "present"
    },
    {
      "name": "STV Norman Klotz",
      "function": "Von der Stadtverordnetenversammlung",
      "status": "present"
    },
    {
      "name": "STV Michel Kögler",
      "function": "Von der Stadtverordnetenversammlung",
      "status": "present"
    },
    {
      "name": "STV Matthias Kücükkaplan",
      "function": "Von der Stadtverordnetenversammlung",
      "status": "present"
    },
    {
      "name": "STV Reiner Leidich",
      "function": "Von der Stadtverordnetenversammlung",
      "status": "present"
    },
    {
      "name": "STV Dr. Melanie Neeb",
      "function": "Von der Stadtverordnetenversammlung",
      "status": "present"
    },
    {
      "name": "STV Marc Werner Punzert",
      "function": "Von der Stadtverordnetenversammlung",
      "status": "present"
    },
    {
      "name": "STV Michaela Schöffmann",
      "function": "Von der Stadtverordnetenversammlung",
      "status": "present"
    },
    {
      "name": "STV Andreas Schuch",
      "function": "Von der Stadtverordnetenversammlung",
      "status": "present"
    },
    {
      "name": "STV Prof. Dr. Helge Stadelmann",
      "function": "Von der Stadtverordnetenversammlung",
      "status": "present"
    },
    {
      "name": "STV Fadi Touma",
      "function": "Von der Stadtverordnetenversammlung",
      "status": "present"
    },
    {
      "name": "STV Malek Yacoub",
      "function": "Von der Stadtverordnetenversammlung",
      "status": "present"
    },
    {
      "name": "STV/023/2021 -2026  Vom Magistrat",
      "function": "Von der Stadtverordnetenversammlung",
      "status": "present"
    },
    {
      "name": "Stadtrat Israel Be Josef",
      "function": "Von der Stadtverordnetenversammlung",
      "status": "present"
    },
    {
      "name": "Stadtrat Jörg Buß",
      "function": "Von der Stadtverordnetenversammlung",
      "status": "present"
    },
    {
      "name": "Stadtrat Ewald Seidler",
      "function": "Von der Stadtverordnetenversammlung",
      "status": "present"
    },
    {
      "name": "Thomas Telling",
      "function": "Schriftführer",
      "status": "present"
    },
    {
      "name": "Entschuldigt :",
      "function": "Schriftführer",
      "status": "present"
    },
    {
      "name": "STV Simon Haf emann",
      "function": "Von der Stadtverordnetenversammlung",
      "status": "present"
    },
    {
      "name": "STV Matthias Jung",
      "function": "Von der Stadtverordnetenversammlung",
      "status": "present"
    },
    {
      "name": "STV Erich Klotz",
      "function": "Von der Stadtverordnetenversammlung",
      "status": "present"
    },
    {
      "name": "STV Fabian Schäfer",
      "function": "Von der Stadtverordnetenversammlung",
      "status": "present"
    },
    {
      "name": "STV Melanie Schunk -Wießner",
      "function": "Von der Stadtverordnetenversammlung",
      "status": "present"
    },
    {
      "name": "STV Simone van Slobbe -Schneider",
      "function": "Von der Stadtverordnetenversammlung",
      "status": "present"
    },
    {
      "name": "Bürgermeister Andreas Ruck",
      "function": "Vom Magistrat",
      "status": "present"
    },
    {
      "name": "Erster Stadtrat Klaus Dieter Gimbel",
      "function": "Vom Magistrat",
      "status": "present"
    },
    {
      "name": "Stadtrat Philipp Niklas Mackowiak",
      "function": "Vom Magistrat",
      "status": "present"
    },
    {
      "name": "Stadtrat Dr. Karl Ernst Rainer Pfaff",
      "function": "Vom Magistrat",
      "status": "present"
    },
    {
      "name": "Stadtrat Wolfgang Sames",
      "function": "Vom Magistrat",
      "status": "present"
    }
  ],
  "attendance_excused": [],
  "total_present": 47,
  "total_excused": 0,
  "total_participants": 47,
  "analysis_method": "Azure + Local",
  "total_pages": 2,
  "extraction_timestamp": "2025-09-13T22:31:27.950531",
  "document_path": "input\\2023_Juli_Stadtverordnetenversammlung_Niederschrift_STV.pdf",
  "full_text": "Stadt Pohlheim\nPohlheim, 26.07.2023\nAz .: STV/023/2021-2026\nNIEDERSCHRIFT\nüber die Sitzung der Stadtverordnetenversammlung der Stadt Pohlheim\nTag:\n20.07.2023\nDauer:\n19:12 Uhr bis 21:25 Uhr\nOrt:\nVolkshalle Watzenborn-Steinberg, Ludwigstraße 33-35, 35415 Pohlheim\nAnwesend:\nVon der Stadtverordnetenversammlung\nStadtverordnetenvorsteherin Hiltrud Hofmann\nSTV Peter Alexander\nSTV Malke Aydin\nab TOP 3\nSTV Angelika Bartosch\nSTV Karsten Becker\nab TOP 3\nSTV Horst Jürgen Briegel\nab TOP 3\nSTV Lukas Budak\nSTV Risko Bulut\nSTV Sonya Can\nSTV Georg Celik\nSTV Iliyo Danho\nSTV Lorenz Diehl\nSTV Kevin Engel\nSTV Björn Feuerbach\nSTV Samuel Gergin\nSTV Eckart Hafemann\nSTV Uwe Happel\nSTV Antje Häuser\nSTV Prof. Dr. Ernst-Ulrich Huster\nSTV Bettina Jost\nSTV Norman Klotz\nSTV Michel Kögler\nSTV Matthias Kücükkaplan\nSTV Reiner Leidich\nSTV Dr. Melanie Neeb\nSTV Marc Werner Punzert\nSTV Michaela Schöffmann\nSTV Andreas Schuch\nSTV Prof. Dr. Helge Stadelmann\nSTV Fadi Touma\nSTV Malek Yacoub\nSeite 1 von 12\nSTV/023/2021-2026\nVom Magistrat\nStadtrat Israel Be Josef\nStadtrat Jörg Buß\nStadtrat Ewald Seidler\nSchriftführer\nThomas Telling\nEntschuldigt:\nVon der Stadtverordnetenversammlung\nSTV Simon Hafemann\nSTV Matthias Jung\nSTV Erich Klotz\nSTV Fabian Schäfer\nSTV Melanie Schunk-Wießner\nSTV Simone van Slobbe-Schneider\nVom Magistrat\nBürgermeister Andreas Ruck\nErster Stadtrat Klaus Dieter Gimbel\nStadtrat Philipp Niklas Mackowiak\nStadtrat Reinhard Peter\nStadtrat Dr. Karl Ernst Rainer Pfaff\nStadtrat Wolfgang Sames\nTAGESORDNUNG:\nTOP 1\nEröffnung sowie Feststellung der ordnungsgemäßen\nLadung und der Beschlussfähigkeit\nTOP 2\nFeststellung der Niederschrift vom 15. Juni 2023\nTOP 3\nVorstellung Bericht Sportentwicklungsplanung Pohlheim\n(ohne Vorlage)\nTOP 4\nBericht über den Haushaltsvollzug zum 30.06.2023\nSTV-237/2021-\n2026\nTOP 5\nAntrag der CDU-Fraktion vom 18.05.2023 betr. Sanie-\nrung des Festplatzes in Watzenborn-Steinberg\nA-215/2021-2026\nTOP 6\nAntrag der SPD-Fraktion vom 3. Juni 2023 betr. Bauge-\nbiet \"Oberweg IV\"\nA-225/2021-2026\nTOP 7\n237. Vergleichende Prüfung \"Personalmanagement III\"\nSTV-224/2021-\n2026\nTOP 8\nEhrung von Mandatsträgern für langjährige Tätigkeiten\nSTV-227/2021-\n2026\nSeite 2 von 12\nSTV/023/2021-2026\n"
}