{
  "id": "Niederschrift_Ausschuss (4)",
  "document_type": "Niederschrift",
  "session_type": null,
  "date": "2024-12-04T00:00:00Z",
  "duration": "19:00 Uhr bis 21:30 Uhr",
  "location": "Sitzungssaal der Stadtverwaltung Pohlheim, Ludwigstraße 33, 35415",
  "attendance": [
    {
      "name": "STV/Vorsitzende Melanie Schunk-Wießner",
      "function": "Vom Haupt- und Finanzausschuss",
      "status": "present"
    },
    {
      "name": "STV/1. stellv. Vorsitzender Eckart Hafemann",
      "function": "Vom Haupt- und Finanzausschuss",
      "status": "present"
    },
    {
      "name": "STV/2. stellv. Vorsitzender Andreas Schuch",
      "function": "Vom Haupt- und Finanzausschuss",
      "status": "present"
    },
    {
      "name": "STV Iliyo Danho",
      "function": "Vom Haupt- und Finanzausschuss",
      "status": "present"
    },
    {
      "name": "STV Prof. Dr. Ernst-Ulrich Huster",
      "function": "Vom Haupt- und Finanzausschuss",
      "status": "present"
    },
    {
      "name": "STV Michel Kögler",
      "function": "Vom Haupt- und Finanzausschuss",
      "status": "present"
    },
    {
      "name": "STV Reiner Leidich für STV Lorenz Diehl",
      "function": "Vom Haupt- und Finanzausschuss",
      "status": "present"
    },
    {
      "name": "STV Dr. Melanie Neeb",
      "function": "Vom Haupt- und Finanzausschuss",
      "status": "present"
    },
    {
      "name": "STV Sebastian Opper",
      "function": "Vom Haupt- und Finanzausschuss",
      "status": "present"
    },
    {
      "name": "STV Prof. Dr. Helge Stadelmann für STV Georg Celik",
      "function": "Vom Haupt- und Finanzausschuss",
      "status": "present"
    },
    {
      "name": "STV-Vorsteherin Hiltrud Hofmann",
      "function": "Von der Stadtverordnetenversammlung",
      "status": "present"
    },
    {
      "name": "Bürgermeister Andreas Ruck",
      "function": "Vom Magistrat",
      "status": "present"
    },
    {
      "name": "Stadtrat Peter Alexander",
      "function": "Vom Magistrat",
      "status": "present"
    },
    {
      "name": "Stadtrat Jörg Buß",
      "function": "Vom Magistrat",
      "status": "present"
    },
    {
      "name": "Stadtrat Christian Görlach",
      "function": "Vom Magistrat",
      "status": "present"
    },
    {
      "name": "Stadtrat Reimar Stenzel",
      "function": "Vom Magistrat",
      "status": "present"
    },
    {
      "name": "VFW Stefan Huster",
      "function": "Schriftführer",
      "status": "present"
    },
    {
      "name": "Zu TOP 3:",
      "function": "Schriftführer",
      "status": "present"
    },
    {
      "name": "Ulrich Schlack (Schlack & Krtschil Rechtsanwälte)",
      "function": "Schriftführer",
      "status": "present"
    },
    {
      "name": "Zu TOP 5-7:",
      "function": "Schriftführer",
      "status": "present"
    },
    {
      "name": "Semen Girin (Betriebsleiter Eigenbetrieb Wasserwerke Pohlheim)",
      "function": "Schriftführer",
      "status": "present"
    },
    {
      "name": "___________",
      "function": "Schriftführer",
      "status": "present"
    },
    {
      "name": "Seite 1 von",
      "function": "Schriftführer",
      "status": "present"
    },
    {
      "name": "HFA/041/2021-2026",
      "function": "Schriftführer",
      "status": "present"
    },
    {
      "name": "Daniel Dettmer-Prause (IVC)",
      "function": "Schriftführer",
      "status": "present"
    },
    {
      "name": "STV Georg Celik",
      "function": "Vom Haupt- und Finanzausschuss",
      "status": "excused"
    },
    {
      "name": "STV Lorenz Diehl",
      "function": "Vom Haupt- und Finanzausschuss",
      "status": "excused"
    },
    {
      "name": "Erster Stadtrat Israel Be Josef",
      "function": "Vom Magistrat",
      "status": "excused"
    },
    {
      "name": "Stadtrat Philipp Niklas Mackowiak",
      "function": "Vom Magistrat",
      "status": "excused"
    },
    {
      "name": "Stadtrat Tobias Maschmann",
      "function": "Vom Magistrat",
      "status": "excused"
    },
    {
      "name": "Stadtrat Wolfgang Sames",
      "function": "Vom Magistrat",
      "status": "excused"
    }
  ],
  "agenda": "TOP 1 Eröffnung sowie Feststellung der ordnungsgemäßen\nLadung und der Beschlussfähigkeit\nTOP 2 Feststellung der Niederschriften vom 28.10.2024 und\n30.10.2024\nTOP 3 Stromkonzessionsverfahren der Stadt Pohlheim STV-362/2021-\n2026\nTOP 4 Beratung und Beschlussfassung über die Hebesatzsat- STV-361/2021-\nzung 2025 bis 2026 2026\nTOP 5 4. Änderungssatzung zur Entwässerungssatzung STV-354/2021-\n2026\nTOP 6 5. Änderungssatzung zur Wasserversorgungssatzung STV-355/2021-\n2026\nTOP 7 Beratung und Beschlussfassung über den Wirtschafts- STV-356/2021-\nplan 2025 des Eigenbetriebs Wasserwerke Pohlheim 2026\nTOP 8 Erneuerung der Kugelstoßanlage auf dem Sportgelände STV-357/2021-\n\"Neumühle\" im Stadtteil Watzenborn-Steinberg; 2026\nTeilaufhebung Sperrvermerk für Haushaltsansatz\nI085601-18\nTOP 9 Planungskosten für die Erneuerung der Sportanlage STV-358/2021-\n___________\n\nHFA/041/2021-2026\n\"Neumühle\" im Stadtteil Watzenborn-Steinberg; 2026\nTeilaufhebung Sperrvermerk für Haushaltsansatz\nI085601-18\nTOP 10 Betriebskommission Wasserwerke Pohlheim; STV-359/2021-\nWahl von zwei Vertreterinnen/Vertretern und zwei Stell- 2026\nvertreterinnen/Stellvertretern in die Betriebskommission\nWasserwerke Pohlheim; Personalrat\nTOP 11 Mitteilungen\nTOP 11.1 Mitteilung 1\nTOP 11.2 Mitteilung 2\nTOP 12 Anfragen\nTOP 12.1 Anfrage 1\nTOP 12.2 Anfrage 2",
  "top_contents": [
    {
      "nummer": "1",
      "ueberschrift": "TOP 1 Eröffnung sowie Feststellung der ordnungsgemäßen Ladung und der Be-\nschlussfähigkeit",
      "vorlage": "",
      "inhalt": "",
      "abstimmung": ""
    }
  ],
  "top_contents_text": "TOP 1\nTOP 1 Eröffnung sowie Feststellung der ordnungsgemäßen Ladung und der Be-\nschlussfähigkeit\n---",
  "analysis_method": "Azure + Local",
  "total_pages": 2,
  "extraction_timestamp": "2025-09-15T23:39:32.181401",
  "document_path": "input\\Niederschrift_Ausschuss (4).pdf",
  "full_text": "Stadt Pohlheim\nPohlheim, 05.12.2024\nAz .: HFA/041/2021-2026\nNIEDERSCHRIFT\nüber die Sitzung des Haupt- und Finanzausschusses der Stadt Pohlheim\nTag:\n04.12.2024\nDauer:\n19:00 Uhr bis 21:30 Uhr\nOrt:\nSitzungssaal der Stadtverwaltung Pohlheim, Ludwigstraße 33, 35415\nPohlheim\nAnwesend:\nVom Haupt- und Finanzausschuss\nSTV/Vorsitzende Melanie Schunk-Wießner\nSTV/1. stellv. Vorsitzender Eckart Hafemann\nSTV/2. stellv. Vorsitzender Andreas Schuch\nSTV Iliyo Danho\nSTV Prof. Dr. Ernst-Ulrich Huster\nSTV Michel Kögler\nSTV Reiner Leidich\nfür STV Lorenz Diehl\nSTV Dr. Melanie Neeb\nSTV Sebastian Opper\nSTV Prof. Dr. Helge Stadelmann\nfür STV Georg Celik\nVon der Stadtverordnetenversammlung\nSTV-Vorsteherin Hiltrud Hofmann\nVom Magistrat\nBürgermeister Andreas Ruck\nStadtrat Peter Alexander\nStadtrat Jörg Buß\nStadtrat Christian Görlach\nStadtrat Reimar Stenzel\nSchriftführer\nVFW Stefan Huster\nZu TOP 3:\nUlrich Schlack (Schlack & Krtschil Rechtsanwälte)\nZu TOP 5-7:\nSemen Girin (Betriebsleiter Eigenbetrieb Wasserwerke Pohlheim)\nSeite 1 von 12\nHFA/041/2021-2026\nDaniel Dettmer-Prause (IVC)\nEntschuldigt:\nVom Haupt- und Finanzausschuss\nSTV Georg Celik\nSTV Lorenz Diehl\nVon der Stadtverordnetenversammlung\nstellvertr. STV-Vorsteher Simon Hafemann\nstellv. STV-Vorsteher Marc Werner Punzert\nVom Magistrat\nErster Stadtrat Israel Be Josef\nStadtrat Philipp Niklas Mackowiak\nStadtrat Tobias Maschmann\nStadtrat Wolfgang Sames\nVom Ausländerbeirat\nMaryam Mourad\nTAGESORDNUNG:\nTOP 1\nEröffnung sowie Feststellung der ordnungsgemäßen\nLadung und der Beschlussfähigkeit\nTOP 2\nFeststellung der Niederschriften vom 28.10.2024 und\n30.10.2024\nTOP 3\nStromkonzessionsverfahren der Stadt Pohlheim\nSTV-362/2021-\n2026\nTOP 4\nBeratung und Beschlussfassung über die Hebesatzsat-\nzung 2025 bis 2026\nSTV-361/2021-\n2026\nTOP 5\n4. Änderungssatzung zur Entwässerungssatzung\nSTV-354/2021-\n2026\nTOP 6\n5. Änderungssatzung zur Wasserversorgungssatzung\nSTV-355/2021-\n2026\nTOP 7\nBeratung und Beschlussfassung über den Wirtschafts-\nplan 2025 des Eigenbetriebs Wasserwerke Pohlheim\nSTV-356/2021-\n2026\nTOP 8\nErneuerung der Kugelstoßanlage auf dem Sportgelände\n\"Neumühle\" im Stadtteil Watzenborn-Steinberg;\nTeilaufhebung Sperrvermerk für Haushaltsansatz\nI085601-18\nSTV-357/2021-\n2026\nTOP 9\nPlanungskosten für die Erneuerung der Sportanlage\nSTV-358/2021-\nSeite 2 von 12\nHFA/041/2021-2026\n"
}