{
  "id": "Niederschrift_Ausschuss (3)",
  "document_type": "Niederschrift",
  "session_type": null,
  "date": "2024-12-02T00:00:00Z",
  "duration": "19:30 Uhr bis 20:20 Uhr",
  "location": "10 Sitzungssaal der Stadtverwaltung Pohlheim, Ludwigstraße 33, 35415",
  "attendance": [
    {
      "name": "STV/1. stellv. Vorsitzender Matthias Kücük-",
      "function": "Vom Ausschuss für Bauen, Stadtentwicklung und Umwelt",
      "status": "present"
    },
    {
      "name": "STV/2. stellv. Vorsitzender Kevin Engel",
      "function": "Vom Ausschuss für Bauen, Stadtentwicklung und Umwelt",
      "status": "present"
    },
    {
      "name": "STV Prof. Dr. Ernst-Ulrich Huster Für STV Siglinde Michen",
      "function": "Vom Ausschuss für Bauen, Stadtentwicklung und Umwelt",
      "status": "present"
    },
    {
      "name": "STV Erich Klotz",
      "function": "Vom Ausschuss für Bauen, Stadtentwicklung und Umwelt",
      "status": "present"
    },
    {
      "name": "STV Reiner Leidich",
      "function": "Vom Ausschuss für Bauen, Stadtentwicklung und Umwelt",
      "status": "present"
    },
    {
      "name": "STV Marc Werner Punzert",
      "function": "Vom Ausschuss für Bauen, Stadtentwicklung und Umwelt",
      "status": "present"
    },
    {
      "name": "STV Michaela Schöffmann",
      "function": "Vom Ausschuss für Bauen, Stadtentwicklung und Umwelt",
      "status": "present"
    },
    {
      "name": "STV Prof. Dr. Helge Stadelmann Für STV Malke Aydin",
      "function": "Vom Ausschuss für Bauen, Stadtentwicklung und Umwelt",
      "status": "present"
    },
    {
      "name": "STV Fadi Touma",
      "function": "Vom Ausschuss für Bauen, Stadtentwicklung und Umwelt",
      "status": "present"
    },
    {
      "name": "STV-Vorsteherin Hiltrud Hofmann",
      "function": "Von der Stadtverordnetenversammlung",
      "status": "present"
    },
    {
      "name": "Bürgermeister Andreas Ruck",
      "function": "Vom Magistrat",
      "status": "present"
    },
    {
      "name": "Erster Stadtrat Israel Be Josef",
      "function": "Vom Magistrat",
      "status": "present"
    },
    {
      "name": "Stadtrat Christian Görlach",
      "function": "Vom Magistrat",
      "status": "present"
    },
    {
      "name": "Stadtrat Tobias Maschmann",
      "function": "Vom Magistrat",
      "status": "present"
    },
    {
      "name": "AM Steffen Becker",
      "function": "Schriftführer(in)",
      "status": "present"
    },
    {
      "name": "___________",
      "function": "Schriftführer(in)",
      "status": "present"
    },
    {
      "name": "Seite 1 von",
      "function": "Schriftführer(in)",
      "status": "present"
    },
    {
      "name": "BSU/037/2021-2026",
      "function": "Schriftführer(in)",
      "status": "present"
    },
    {
      "name": "STV Malke Aydin",
      "function": "Vom Ausschuss für Bauen, Stadtentwicklung und Umwelt",
      "status": "excused"
    },
    {
      "name": "STV Siglinde Michen",
      "function": "Vom Ausschuss für Bauen, Stadtentwicklung und Umwelt",
      "status": "excused"
    },
    {
      "name": "Stadtrat Peter Alexander",
      "function": "Vom Magistrat",
      "status": "excused"
    },
    {
      "name": "Stadtrat Jörg Buß",
      "function": "Vom Magistrat",
      "status": "excused"
    },
    {
      "name": "Stadtrat Philipp Niklas Mackowiak",
      "function": "Vom Magistrat",
      "status": "excused"
    },
    {
      "name": "Stadtrat Wolfgang Sames",
      "function": "Vom Magistrat",
      "status": "excused"
    },
    {
      "name": "Stadtrat Reimar Stenzel",
      "function": "Vom Magistrat",
      "status": "excused"
    }
  ],
  "agenda": "TOP 1 Eröffnung sowie Feststellung der ordnungsgemäßen\nLadung und der Beschlussfähigkeit\nTOP 2 Feststellung der Niederschrift vom 28.10.2024\nTOP 3 Errichtung einer Norma Filiale im Stadtteil Grüningen; STV-360/2021-\nVorstellung der Planungsabsichten 2026\nTOP 4 Mitteilungen\nTOP 4.1 Mitteilung 1\nTOP 4.2 Mitteilung 2\nTOP 4.3 Mitteilung 3\nTOP 4.4 Mitteilung 4\nTOP 4.5 Mitteilung 5\nTOP 4.6 Mitteilung 6\nTOP 5 Anfragen\n___________\n\nBSU/037/2021-2026\n--- SEITE 3 ---",
  "top_contents": [
    {
      "nummer": "1",
      "ueberschrift": "TOP 1 Eröffnung sowie Feststellung der ordnungsgemäßen Ladung und der Be-\nschlussfähigkeit",
      "vorlage": "",
      "inhalt": "",
      "abstimmung": ""
    }
  ],
  "top_contents_text": "TOP 1\nTOP 1 Eröffnung sowie Feststellung der ordnungsgemäßen Ladung und der Be-\nschlussfähigkeit\n---",
  "analysis_method": "Azure + Local",
  "total_pages": 2,
  "extraction_timestamp": "2025-09-15T23:38:46.657493",
  "document_path": "input\\Niederschrift_Ausschuss (3).pdf",
  "full_text": "Stadt Pohlheim\nPohlheim, 03.12.2024\nAz .: BSU/037/2021-2026\nNIEDERSCHRIFT\nüber die Sitzung des Ausschusses für Bauen, Stadtentwicklung und Umwelt der Stadt\nPohlheim\nTag:\n02.12.2024\nDauer:\n19:30 Uhr bis 20:20 Uhr\nOrt:\n10 Sitzungssaal der Stadtverwaltung Pohlheim, Ludwigstraße 33, 35415\nPohlheim\nAnwesend:\nVom Ausschuss für Bauen, Stadtentwicklung und Umwelt\nVorsitzender Eckart Hafemann\nSTV/1. stellv. Vorsitzender Matthias Kücük-\nkaplan\nSTV/2. stellv. Vorsitzender Kevin Engel\nSTV Prof. Dr. Ernst-Ulrich Huster\nSTV Erich Klotz\nSTV Reiner Leidich\nSTV Marc Werner Punzert\nSTV Michaela Schöffmann\nSTV Prof. Dr. Helge Stadelmann\nSTV Fadi Touma\nFür STV Siglinde Michen\nFür STV Malke Aydin\nVon der Stadtverordnetenversammlung\nSTV-Vorsteherin Hiltrud Hofmann\nVom Magistrat\nBürgermeister Andreas Ruck\nErster Stadtrat Israel Be Josef\nStadtrat Christian Görlach\nStadtrat Tobias Maschmann\nSchriftführer(in)\nAM Steffen Becker\nSeite 1 von 4\nBSU/037/2021-2026\nEntschuldigt:\nVom Ausschuss für Bauen, Stadtentwicklung und Umwelt\nSTV Malke Aydin\nSTV Siglinde Michen\nVon der Stadtverordnetenversammlung\nstellv. STV-Vorsteher Simon Hafemann\nstellv. STV-Vorsteher Andreas Schuch\nVom Magistrat\nStadtrat Peter Alexander\nStadtrat Jörg Buß\nStadtrat Philipp Niklas Mackowiak\nStadtrat Wolfgang Sames\nStadtrat Reimar Stenzel\nVom Ausländerbeirat\nVorsitzende Maryam Mourad\nTAGESORDNUNG:\nTOP 1\nEröffnung sowie Feststellung der ordnungsgemäßen\nLadung und der Beschlussfähigkeit\nTOP 2\nFeststellung der Niederschrift vom 28.10.2024\nTOP 3\nErrichtung einer Norma Filiale im Stadtteil Grüningen;\nVorstellung der Planungsabsichten\nSTV-360/2021-\n2026\nTOP 4\nMitteilungen\nTOP 4.1\nMitteilung 1\nTOP 4.2\nMitteilung 2\nTOP 4.3\nMitteilung 3\nTOP 4.4\nMitteilung 4\nTOP 4.5\nMitteilung 5\nTOP 4.6\nMitteilung 6\nTOP 5\nAnfragen\nSeite 2 von 4\nBSU/037/2021-2026\n"
}