{
  "id": "Niederschrift_Ausschuss (1)",
  "document_type": "Niederschrift",
  "session_type": null,
  "date": "2025-01-15T00:00:00Z",
  "duration": "19:30 Uhr bis 20:32 Uhr",
  "location": "Sitzungssaal der Stadtverwaltung Pohlheim, Ludwigstraße 33, 35415",
  "attendance": [
    {
      "name": "STV/1. stellv. Vorsitzender Eckart Hafemann",
      "function": "Vom Haupt- und Finanzausschuss",
      "status": "present"
    },
    {
      "name": "STV Georg Celik",
      "function": "Vom Haupt- und Finanzausschuss",
      "status": "present"
    },
    {
      "name": "STV Iliyo Danho",
      "function": "Vom Haupt- und Finanzausschuss",
      "status": "present"
    },
    {
      "name": "STV Lorenz Diehl ab TOP",
      "function": "Vom Haupt- und Finanzausschuss",
      "status": "present"
    },
    {
      "name": "STV Uwe Happel für STV Melanie Schunk-Wießner",
      "function": "Vom Haupt- und Finanzausschuss",
      "status": "present"
    },
    {
      "name": "STV Prof. Dr. Ernst-Ulrich Huster",
      "function": "Vom Haupt- und Finanzausschuss",
      "status": "present"
    },
    {
      "name": "STV Michel Kögler",
      "function": "Vom Haupt- und Finanzausschuss",
      "status": "present"
    },
    {
      "name": "STV Reiner Leidich für STV Dr. Melanie Neeb",
      "function": "Vom Haupt- und Finanzausschuss",
      "status": "present"
    },
    {
      "name": "STV Sebastian Opper",
      "function": "Vom Haupt- und Finanzausschuss",
      "status": "present"
    },
    {
      "name": "STV-Vorsteherin Hiltrud Hofmann",
      "function": "Von der Stadtverordnetenversammlung",
      "status": "present"
    },
    {
      "name": "Bürgermeister Andreas Ruck",
      "function": "Vom Magistrat",
      "status": "present"
    },
    {
      "name": "Erster Stadtrat Israel Be Josef",
      "function": "Vom Magistrat",
      "status": "present"
    },
    {
      "name": "Stadtrat Jörg Buß",
      "function": "Vom Magistrat",
      "status": "present"
    },
    {
      "name": "Stadtrat Christian Görlach",
      "function": "Vom Magistrat",
      "status": "present"
    },
    {
      "name": "VBW Bianca Krieb",
      "function": "Schriftführerin",
      "status": "present"
    },
    {
      "name": "STV/2. stellv. Vorsitzender Andreas Schuch",
      "function": "Vom Haupt- und Finanzausschuss",
      "status": "excused"
    },
    {
      "name": "Stadtrat Peter Alexander",
      "function": "Vom Magistrat",
      "status": "excused"
    },
    {
      "name": "Stadtrat Philipp Niklas Mackowiak",
      "function": "Vom Magistrat",
      "status": "excused"
    },
    {
      "name": "Stadtrat Tobias Maschmann",
      "function": "Vom Magistrat",
      "status": "excused"
    },
    {
      "name": "Stadtrat Wolfgang Sames",
      "function": "Vom Magistrat",
      "status": "excused"
    },
    {
      "name": "Stadtrat Reimar Stenzel",
      "function": "Vom Magistrat",
      "status": "excused"
    }
  ],
  "agenda": "TOP 1 Eröffnung sowie Feststellung der ordnungsgemäßen\nLadung und der Beschlussfähigkeit\nTOP 2 Feststellung der Niederschrift vom 04.12.2024\nTOP 3 Antrag der FDP-Fraktion vom 18. Dezember 2024 betr. A-367/2021-2026\nÜberarbeitung der Gebührensatzungen\nTOP 4 Antrag der CDU-Fraktion vom 4. Januar 2025 betr. Sa- A-368/2021-2026\nnierungsgutachten und Finanzierung des Hallenbades\nTOP 5 Mitteilungen\nTOP 5.1 Mitteilung 1\nTOP 5.2 Mitteilung 2\nTOP 6 Anfragen",
  "top_contents": [
    {
      "nummer": "1",
      "ueberschrift": "TOP 1 Eröffnung sowie Feststellung der ordnungsgemäßen Ladung und der Be-\nschlussfähigkeit\nDer stellvertretende",
      "vorlage": "",
      "inhalt": "",
      "abstimmung": ""
    }
  ],
  "top_contents_text": "TOP 1\nTOP 1 Eröffnung sowie Feststellung der ordnungsgemäßen Ladung und der Be-\nschlussfähigkeit\nDer stellvertretende\n---",
  "analysis_method": "Azure + Local",
  "total_pages": 2,
  "extraction_timestamp": "2025-09-15T23:38:34.658736",
  "document_path": "input\\Niederschrift_Ausschuss (1).pdf",
  "full_text": "Stadt Pohlheim\nPohlheim, 21.01.2025\nAz .: HFA/042/2021-2026\nNIEDERSCHRIFT\nüber die Sitzung des Haupt- und Finanzausschusses der Stadt Pohlheim\nTag:\n15.01.2025\nDauer:\n19:30 Uhr bis 20:32 Uhr\nOrt:\nSitzungssaal der Stadtverwaltung Pohlheim, Ludwigstraße 33, 35415\nPohlheim\nAnwesend:\nVom Haupt- und Finanzausschuss\nSTV/1. stellv. Vorsitzender Eckart Hafemann\nSTV Georg Celik\nSTV Iliyo Danho\nSTV Lorenz Diehl\nSTV Uwe Happel\nSTV Prof. Dr. Ernst-Ulrich Huster\nSTV Michel Kögler\nSTV Reiner Leidich\nSTV Sebastian Opper\nab TOP 3\nfür STV Melanie Schunk-Wießner\nfür STV Dr. Melanie Neeb\nVon der Stadtverordnetenversammlung\nSTV-Vorsteherin Hiltrud Hofmann\nstellvertr. STV-Vorsteher Prof. Dr. Helge Sta- bis TOP 2 für STV Lorenz Diehl\ndelmann\nVom Magistrat\nBürgermeister Andreas Ruck\nErster Stadtrat Israel Be Josef\nStadtrat Jörg Buß\nStadtrat Christian Görlach\nSchriftführerin\nVBW Bianca Krieb\nEntschuldigt:\nVom Haupt- und Finanzausschuss\nSTV/2. stellv. Vorsitzender Andreas Schuch\nSeite 1 von 5\nHFA/042/2021-2026\nVon der Stadtverordnetenversammlung\nstellvertr. STV-Vorsteher Simon Hafemann\nstellv. STV-Vorsteher Marc Werner Punzert\nVom Magistrat\nStadtrat Peter Alexander\nStadtrat Philipp Niklas Mackowiak\nStadtrat Tobias Maschmann\nStadtrat Wolfgang Sames\nStadtrat Reimar Stenzel\nVom Ausländerbeirat\nVors. Maryam Mourad\nTAGESORDNUNG:\nTOP 1\nEröffnung sowie Feststellung der ordnungsgemäßen\nLadung und der Beschlussfähigkeit\nTOP 2\nFeststellung der Niederschrift vom 04.12.2024\nTOP 3\nAntrag der FDP-Fraktion vom 18. Dezember 2024 betr.\nÜberarbeitung der Gebührensatzungen\nA-367/2021-2026\nTOP 4\nAntrag der CDU-Fraktion vom 4. Januar 2025 betr. Sa-\nnierungsgutachten und Finanzierung des Hallenbades\nA-368/2021-2026\nTOP 5\nMitteilungen\nTOP 5.1\nMitteilung 1\nTOP 5.2\nMitteilung 2\nTOP 6\nAnfragen\nTOP 1\nEröffnung sowie Feststellung der ordnungsgemäßen Ladung und der Be-\nschlussfähigkeit\nDer stellvertretende Vorsitzende Eckart Hafemann eröffnet die Sitzung, begrüßt die Anwe-\nsenden und stellt die ordnungsgemäße Ladung und Beschlussfähigkeit fest.\nZu TOP 4 gibt der stellvertretende Vorsitzende kurzzeitig den Vorsitz für einen Beitrag ab.\nTOP 2\nFeststellung der Niederschrift vom 04.12.2024\nSTV Sebastian Opper trug Einwände zur Protokollierung des TOP 4 Beratung und Be-\nschlussfassung über die Hebesatzsatzung 2025 bis 2026 vor. Auf Nachfrage des stellvertre-\nSeite 2 von 5\nHFA/042/2021-2026\n"
}