{
  "id": "Niederschrift_Ausschuss (2)",
  "document_type": "Niederschrift",
  "session_type": null,
  "date": "2025-01-14T00:00:00Z",
  "duration": "19:34 Uhr bis 21:00 Uhr",
  "location": "Kleiner Saal der Volkshalle, Eingang Ludwigstraße, Ludwigstraße 33-35,",
  "attendance": [
    {
      "name": "STV/1. stellv. Vorsitzende Simone van Slob-",
      "function": "Vom Ausschuss für Soziales, Kultur und Sport",
      "status": "present"
    },
    {
      "name": "STV Angelika Bartosch",
      "function": "Vom Ausschuss für Soziales, Kultur und Sport",
      "status": "present"
    },
    {
      "name": "STV Lukas Be Josef",
      "function": "Vom Ausschuss für Soziales, Kultur und Sport",
      "status": "present"
    },
    {
      "name": "STV/2. stellv. Vorsitzende Sonya Can",
      "function": "Vom Ausschuss für Soziales, Kultur und Sport",
      "status": "present"
    },
    {
      "name": "STV Björn Feuerbach",
      "function": "Vom Ausschuss für Soziales, Kultur und Sport",
      "status": "present"
    },
    {
      "name": "STV Reiner Leidich",
      "function": "Vom Ausschuss für Soziales, Kultur und Sport",
      "status": "present"
    },
    {
      "name": "STV Marc Werner Punzert",
      "function": "Vom Ausschuss für Soziales, Kultur und Sport",
      "status": "present"
    },
    {
      "name": "STV Michaela Schöffmann",
      "function": "Vom Ausschuss für Soziales, Kultur und Sport",
      "status": "present"
    },
    {
      "name": "STV Prof. Dr. Helge Stadelmann",
      "function": "Vom Ausschuss für Soziales, Kultur und Sport",
      "status": "present"
    },
    {
      "name": "STV-Vorsteherin Hiltrud Hofmann",
      "function": "Von der Stadtverordnetenversammlung",
      "status": "present"
    },
    {
      "name": "Bürgermeister Andreas Ruck",
      "function": "Vom Magistrat",
      "status": "present"
    },
    {
      "name": "Erster Stadtrat Israel Be Josef",
      "function": "Vom Magistrat",
      "status": "present"
    },
    {
      "name": "Stadtrat Jörg Buß",
      "function": "Vom Magistrat",
      "status": "present"
    },
    {
      "name": "Stadtrat Tobias Maschmann",
      "function": "Vom Magistrat",
      "status": "present"
    },
    {
      "name": "VFW Sabine Kalitzke",
      "function": "Schriftführer(in)",
      "status": "present"
    },
    {
      "name": "Stadtrat Peter Alexander",
      "function": "Vom Magistrat",
      "status": "excused"
    },
    {
      "name": "Stadtrat Christian Görlach",
      "function": "Vom Magistrat",
      "status": "excused"
    },
    {
      "name": "Stadtrat Philipp Niklas Mackowiak",
      "function": "Vom Magistrat",
      "status": "excused"
    },
    {
      "name": "Stadtrat Wolfgang Sames",
      "function": "Vom Magistrat",
      "status": "excused"
    },
    {
      "name": "Stadtrat Reimar Stenzel",
      "function": "Vom Magistrat",
      "status": "excused"
    }
  ],
  "agenda": "TOP 1 Eröffnung sowie Feststellung der ordnungsgemäßen\nLadung und der Beschlussfähigkeit\nTOP 2 Feststellung der Niederschriften vom 01.10.2024 und\n28.10.2024\nTOP 3 Antrag der Fraktionen SPD, FDP und Bündnis 90/Die A-365/2021-2026\nGrünen vom 1. Dezember 2024 betr. Umsetzung der\nPV-Strategie\nTOP 4 Antrag der Fraktionen SPD und Bündnis 90/Die Grünen A-369/2021-2026\nvom 6. Januar 2025 betr. Priorisierung und Umsetzung\nder Maßnahmen für den Radverkehr lt. Radwegever-\nkehrskonzept\nTOP 5 Wahl einer stellv. Schriftführerin/eines stellv. Schriftfüh- SKS-370/2021-\nrers für den SKS 2026\nTOP 6 Antrag der Fraktionen SPD, FDP und Bündnis 90/Die A-366/2021-2026\nGrünen vom 1. Dezember 2024 betr. Monitoring in der\noffenen und aufsuchenden Jugendarbeit\nTOP 7 Umfrage Kitas Stadt Pohlheim; Behandlung der Fragen\nzu den Ergebnissen\nTOP 8 Mitteilungen\nTOP 8.1 Mitteilung 1\nTOP 9 Anfragen\nTOP 9.1 Anfrage 1\n___________\n\nSKS/034/2021-2026\n--- SEITE 3 ---",
  "top_contents": [
    {
      "nummer": "1",
      "ueberschrift": "TOP 1 Eröffnung sowie Feststellung der ordnungsgemäßen Ladung und der Be-\nschlussfähigkeit",
      "vorlage": "",
      "inhalt": "",
      "abstimmung": ""
    }
  ],
  "top_contents_text": "TOP 1\nTOP 1 Eröffnung sowie Feststellung der ordnungsgemäßen Ladung und der Be-\nschlussfähigkeit\n---",
  "analysis_method": "Azure + Local",
  "total_pages": 2,
  "extraction_timestamp": "2025-09-15T23:38:42.409126",
  "document_path": "input\\Niederschrift_Ausschuss (2).pdf",
  "full_text": "Stadt Pohlheim\nPohlheim, 17.01.2025\nAz .: SKS/034/2021-2026\nNIEDERSCHRIFT\nüber die Sitzung des Ausschusses für Soziales, Kultur und Sport der Stadt Pohlheim\nTag:\n14.01.2025\nDauer:\n19:34 Uhr bis 21:00 Uhr\nOrt:\nKleiner Saal der Volkshalle, Eingang Ludwigstraße, Ludwigstraße 33-35,\n35415 Pohlheim\nAnwesend:\nVom Ausschuss für Soziales, Kultur und Sport\nVorsitzender Uwe Happel\nSTV/1. stellv. Vorsitzende Simone van Slob-\nbe-Schneider\nSTV Angelika Bartosch\nSTV Lukas Be Josef\nSTV/2. stellv. Vorsitzende Sonya Can\nSTV Björn Feuerbach\nSTV Reiner Leidich\nSTV Marc Werner Punzert\nSTV Michaela Schöffmann\nSTV Prof. Dr. Helge Stadelmann\nVon der Stadtverordnetenversammlung\nSTV-Vorsteherin Hiltrud Hofmann\nVom Magistrat\nBürgermeister Andreas Ruck\nErster Stadtrat Israel Be Josef\nStadtrat Jörg Buß\nStadtrat Tobias Maschmann\nSchriftführer(in)\nVFW Sabine Kalitzke\nEntschuldigt:\nVon der Stadtverordnetenversammlung\nstellvertr. STV-Vorsteher Simon Hafemann\nSeite 1 von 6\nSKS/034/2021-2026\nstellvertr. STV-Vorsteher Prof. Dr. Ernst-\nUlrich Huster\nstellvertr. STV-Vorsteher Andreas Schuch\nVom Magistrat\nStadtrat Peter Alexander\nStadtrat Christian Görlach\nStadtrat Philipp Niklas Mackowiak\nStadtrat Wolfgang Sames\nStadtrat Reimar Stenzel\nVom Ausländerbeirat\nVorsitzende Maryam Mourad\nTAGESORDNUNG:\nTOP 1\nEröffnung sowie Feststellung der ordnungsgemäßen\nLadung und der Beschlussfähigkeit\nTOP 2\nFeststellung der Niederschriften vom 01.10.2024 und\n28.10.2024\nTOP 3\nAntrag der Fraktionen SPD, FDP und Bündnis 90/Die\nGrünen vom 1. Dezember 2024 betr. Umsetzung der\nPV-Strategie\nA-365/2021-2026\nTOP 4\nAntrag der Fraktionen SPD und Bündnis 90/Die Grünen\nvom 6. Januar 2025 betr. Priorisierung und Umsetzung\nder Maßnahmen für den Radverkehr lt. Radwegever-\nkehrskonzept\nA-369/2021-2026\nTOP 5\nWahl einer stellv. Schriftführerin/eines stellv. Schriftfüh-\nrers für den SKS\nSKS-370/2021-\n2026\nTOP 6\nAntrag der Fraktionen SPD, FDP und Bündnis 90/Die\nGrünen vom 1. Dezember 2024 betr. Monitoring in der\noffenen und aufsuchenden Jugendarbeit\nA-366/2021-2026\nTOP 7\nUmfrage Kitas Stadt Pohlheim; Behandlung der Fragen\nzu den Ergebnissen\nTOP 8\nMitteilungen\nTOP 8.1\nMitteilung 1\nTOP 9\nAnfragen\nTOP 9.1\nAnfrage 1\nSeite 2 von 6\nSKS/034/2021-2026\n"
}